{
  "$schema": "https://json-schema.org/draft/2020-12/schema",
  "$id": "https://github.com/risaac09/gene-keys-data/schemas/human-design.schema.json",
  "title": "Human Design bodygraph structure",
  "description": "The bodygraph wiring as structural fact: nine centers, gate-to-center membership, and the 36 channels as gate pairs. Gate numbers share the King Wen numbering with hexagrams.json. Keynote text is not included; this schema describes the substrate only.",
  "type": "object",
  "required": ["id", "description", "center_count", "channel_count", "centers", "channels"],
  "additionalProperties": false,
  "properties": {
    "id": {
      "type": "string",
      "const": "bodygraph"
    },
    "description": {
      "type": "string"
    },
    "center_count": {
      "type": "integer",
      "const": 9
    },
    "channel_count": {
      "type": "integer",
      "const": 36
    },
    "centers": {
      "type": "array",
      "minItems": 9,
      "maxItems": 9,
      "items": {
        "type": "object",
        "required": ["name", "gates"],
        "additionalProperties": false,
        "properties": {
          "name": {
            "enum": ["Head", "Ajna", "Throat", "G", "Heart", "SolarPlexus", "Sacral", "Spleen", "Root"],
            "description": "Center token. Matches the enum used by downstream consumers so joins stay mechanical."
          },
          "gates": {
            "type": "array",
            "minItems": 1,
            "uniqueItems": true,
            "items": { "type": "integer", "minimum": 1, "maximum": 64 },
            "description": "Gates housed in this center. Every gate 1 to 64 appears in exactly one center; examples/validate.py enforces the partition."
          }
        }
      }
    },
    "channels": {
      "type": "array",
      "minItems": 36,
      "maxItems": 36,
      "items": {
        "type": "object",
        "required": ["id", "gates", "centers", "name"],
        "additionalProperties": false,
        "properties": {
          "id": {
            "type": "string",
            "pattern": "^[0-9]{1,2}-[0-9]{1,2}$",
            "description": "The channel's gate pair as low-high, e.g. '25-51'."
          },
          "gates": {
            "type": "array",
            "minItems": 2,
            "maxItems": 2,
            "uniqueItems": true,
            "items": { "type": "integer", "minimum": 1, "maximum": 64 }
          },
          "centers": {
            "type": "array",
            "minItems": 2,
            "maxItems": 2,
            "uniqueItems": true,
            "items": {
              "enum": ["Head", "Ajna", "Throat", "G", "Heart", "SolarPlexus", "Sacral", "Spleen", "Root"]
            },
            "description": "The two centers this channel connects. Derivable from the gates' center membership; examples/validate.py checks the consistency."
          },
          "name": {
            "type": ["string", "null"],
            "description": "The canonical channel keynote name from Ra Uru Hu's published material. Stays null in this repo pending canonical contribution; the same precedent as the hexagram name field."
          }
        }
      }
    }
  }
}
